{"algorithm":"typaxis.advanced-pagination-manifest/1","flow_registry_sha256":"f1a875f870524d09a4674dfe65b50e1b0cf8b395aeca549654c1a02884e9d7c7","pages":[{"balance":null,"crop_box":[0,0,20,20],"float_carries":[{"carry_count":1,"figure_node_id":11,"float_flow_id":5,"source_page_index":0,"target_page_index":1},{"carry_count":1,"figure_node_id":14,"float_flow_id":7,"source_page_index":0,"target_page_index":1},{"carry_count":1,"figure_node_id":17,"float_flow_id":9,"source_page_index":0,"target_page_index":1}],"float_placements":[{"bounds":{"height":4,"width":5,"x":1,"y":2},"caption_terminal":true,"class":"here","column_index":0,"figure_node_id":3,"float_flow_id":1,"float_terminal":true,"frame_paint_ordinal":1,"page_index":0},{"bounds":{"height":8,"width":6,"x":7,"y":1},"caption_terminal":true,"class":"top","column_index":1,"figure_node_id":8,"float_flow_id":3,"float_terminal":true,"frame_paint_ordinal":0,"page_index":0}],"float_queue_after":[{"anchor_body_flow_id":0,"anchor_position":{"flow_id":0,"ordinal":4},"carry_count":1,"figure_node_id":11,"float_flow_id":5},{"anchor_body_flow_id":0,"anchor_position":{"flow_id":0,"ordinal":5},"carry_count":1,"figure_node_id":14,"float_flow_id":7},{"anchor_body_flow_id":0,"anchor_position":{"flow_id":0,"ordinal":6},"carry_count":1,"figure_node_id":17,"float_flow_id":9}],"float_queue_before":[],"frames":[{"after_position":{"flow_id":0,"ordinal":7},"before_position":{"flow_id":0,"ordinal":0},"column_index":0,"frame_flow_id":11,"kind":"body","rect":{"height":10,"width":5,"x":1,"y":1},"repetition_index":null,"source_flow_id":0,"terminal":true},{"after_position":{"flow_id":0,"ordinal":7},"before_position":{"flow_id":0,"ordinal":7},"column_index":1,"frame_flow_id":12,"kind":"body","rect":{"height":10,"width":6,"x":7,"y":1},"repetition_index":null,"source_flow_id":0,"terminal":true}],"margins":{"bottom":9,"left":1,"right":7,"top":1},"master_id":"single","media_box":[0,0,20,20],"page_index":0,"trim_box":[0,0,20,20]},{"balance":null,"crop_box":[0,0,20,20],"float_carries":[{"carry_count":2,"figure_node_id":17,"float_flow_id":9,"source_page_index":1,"target_page_index":2}],"float_placements":[{"bounds":{"height":8,"width":5,"x":1,"y":1},"caption_terminal":true,"class":"top","column_index":0,"figure_node_id":11,"float_flow_id":5,"float_terminal":true,"frame_paint_ordinal":0,"page_index":1},{"bounds":{"height":8,"width":6,"x":7,"y":1},"caption_terminal":true,"class":"top","column_index":1,"figure_node_id":14,"float_flow_id":7,"float_terminal":true,"frame_paint_ordinal":0,"page_index":1}],"float_queue_after":[{"anchor_body_flow_id":0,"anchor_position":{"flow_id":0,"ordinal":6},"carry_count":2,"figure_node_id":17,"float_flow_id":9}],"float_queue_before":[{"anchor_body_flow_id":0,"anchor_position":{"flow_id":0,"ordinal":4},"carry_count":1,"figure_node_id":11,"float_flow_id":5},{"anchor_body_flow_id":0,"anchor_position":{"flow_id":0,"ordinal":5},"carry_count":1,"figure_node_id":14,"float_flow_id":7},{"anchor_body_flow_id":0,"anchor_position":{"flow_id":0,"ordinal":6},"carry_count":1,"figure_node_id":17,"float_flow_id":9}],"frames":[{"after_position":{"flow_id":0,"ordinal":7},"before_position":{"flow_id":0,"ordinal":7},"column_index":0,"frame_flow_id":11,"kind":"body","rect":{"height":10,"width":5,"x":1,"y":1},"repetition_index":null,"source_flow_id":0,"terminal":true},{"after_position":{"flow_id":0,"ordinal":7},"before_position":{"flow_id":0,"ordinal":7},"column_index":1,"frame_flow_id":12,"kind":"body","rect":{"height":10,"width":6,"x":7,"y":1},"repetition_index":null,"source_flow_id":0,"terminal":true}],"margins":{"bottom":9,"left":1,"right":7,"top":1},"master_id":"single","media_box":[0,0,20,20],"page_index":1,"trim_box":[0,0,20,20]},{"balance":null,"crop_box":[0,0,20,20],"float_carries":[],"float_placements":[{"bounds":{"height":8,"width":5,"x":1,"y":1},"caption_terminal":true,"class":"top","column_index":0,"figure_node_id":17,"float_flow_id":9,"float_terminal":true,"frame_paint_ordinal":0,"page_index":2}],"float_queue_after":[],"float_queue_before":[{"anchor_body_flow_id":0,"anchor_position":{"flow_id":0,"ordinal":6},"carry_count":2,"figure_node_id":17,"float_flow_id":9}],"frames":[{"after_position":{"flow_id":0,"ordinal":7},"before_position":{"flow_id":0,"ordinal":7},"column_index":0,"frame_flow_id":11,"kind":"body","rect":{"height":10,"width":5,"x":1,"y":1},"repetition_index":null,"source_flow_id":0,"terminal":true},{"after_position":{"flow_id":0,"ordinal":7},"before_position":{"flow_id":0,"ordinal":7},"column_index":1,"frame_flow_id":12,"kind":"body","rect":{"height":10,"width":6,"x":7,"y":1},"repetition_index":null,"source_flow_id":0,"terminal":true}],"margins":{"bottom":9,"left":1,"right":7,"top":1},"master_id":"single","media_box":[0,0,20,20],"page_index":2,"trim_box":[0,0,20,20]}],"paint_closure_sha256":"af1df01adbf39e1b87c5e2d56f7bcb9c928a43e1d4f7a95622ae16810525540b","profile":"typaxis.machine-pdf/float-1","profile_receipt_sha256":"9419effde9a4481c3158f90428a59087d914032541c6e54bc167407c37b0994b","selected_layout_sha256":"4d3a601a20c0af181bf136f6dda8f8db554b2e907305471195c28c55c53e6ec6"}
