{"algorithm":"typaxis.advanced-pagination-manifest/1","flow_registry_sha256":"38cd1d7ea5d85c3220515ca385067eaa173c8b5b8ec06bc45b6e7b4e4b722b61","pages":[{"balance":null,"crop_box":[0,0,20,20],"float_carries":[],"float_placements":[],"float_queue_after":[],"float_queue_before":[],"frames":[{"after_position":{"flow_id":0,"ordinal":2},"before_position":{"flow_id":0,"ordinal":0},"column_index":0,"frame_flow_id":3,"kind":"body","rect":{"height":10,"width":5,"x":1,"y":1},"repetition_index":null,"source_flow_id":0,"terminal":false},{"after_position":{"flow_id":0,"ordinal":4},"before_position":{"flow_id":0,"ordinal":2},"column_index":1,"frame_flow_id":4,"kind":"body","rect":{"height":10,"width":6,"x":7,"y":1},"repetition_index":null,"source_flow_id":0,"terminal":false}],"margins":{"bottom":9,"left":1,"right":7,"top":1},"master_id":"single","media_box":[0,0,20,20],"page_index":0,"trim_box":[0,0,20,20]},{"balance":{"algorithm":"typaxis.column-balance-candidates/1","candidate_count":2,"input_sha256":"4d9660c12088546cc286fc06c1fc780eb573018d9d58a08ef664dbd25bbc572e","receipt_sha256":"17372e19e7279989fc0d19296b1b8ca30e14061d7275426ecb9a559d7110466f","selected_target_height":4},"crop_box":[0,0,20,20],"float_carries":[],"float_placements":[],"float_queue_after":[],"float_queue_before":[],"frames":[{"after_position":{"flow_id":0,"ordinal":5},"before_position":{"flow_id":0,"ordinal":4},"column_index":0,"frame_flow_id":3,"kind":"body","rect":{"height":4,"width":5,"x":1,"y":1},"repetition_index":null,"source_flow_id":0,"terminal":true},{"after_position":{"flow_id":0,"ordinal":5},"before_position":{"flow_id":0,"ordinal":5},"column_index":1,"frame_flow_id":4,"kind":"body","rect":{"height":4,"width":6,"x":7,"y":1},"repetition_index":null,"source_flow_id":0,"terminal":true}],"margins":{"bottom":9,"left":1,"right":7,"top":1},"master_id":"single","media_box":[0,0,20,20],"page_index":1,"trim_box":[0,0,20,20]}],"paint_closure_sha256":"84ac273e073ffbc11e740a67888dc3a72df664585f3b933db03cd6888411ed8b","profile":"typaxis.machine-pdf/columns-1","profile_receipt_sha256":"e42e4bff874f793f6c7d9c0b75e1ef650b6133e09eb5b89cc104c234deb1e2cb","selected_layout_sha256":"20e5dc59c29e1ef3eb6924ec200a16b5e9bd4784e38e763c81ad3c97e4a05af1"}
