{"algorithm":"typaxis.advanced-pagination-manifest/1","flow_registry_sha256":"71e74cb0e9feee19631049b217e52d52c43dc6245532ade82240833285345830","pages":[{"balance":null,"crop_box":[0,0,40000000,50000000],"float_carries":[],"float_placements":[],"float_queue_after":[],"float_queue_before":[],"frames":[{"after_position":{"flow_id":3,"ordinal":1},"before_position":{"flow_id":3,"ordinal":0},"column_index":null,"frame_flow_id":3,"kind":"header","rect":{"height":3000000,"width":34000000,"x":3000000,"y":2000000},"repetition_index":0,"source_flow_id":3,"terminal":true},{"after_position":{"flow_id":0,"ordinal":4},"before_position":{"flow_id":0,"ordinal":0},"column_index":0,"frame_flow_id":0,"kind":"body","rect":{"height":38000000,"width":34000000,"x":3000000,"y":6000000},"repetition_index":null,"source_flow_id":0,"terminal":false},{"after_position":{"flow_id":4,"ordinal":0},"before_position":{"flow_id":4,"ordinal":0},"column_index":null,"frame_flow_id":4,"kind":"footer","rect":{"height":3000000,"width":34000000,"x":3000000,"y":45000000},"repetition_index":0,"source_flow_id":4,"terminal":true}],"margins":{"bottom":5000000,"left":2000000,"right":2000000,"top":5000000},"master_id":"first","media_box":[0,0,40000000,50000000],"page_index":0,"trim_box":[1000000,1000000,39000000,49000000]},{"balance":null,"crop_box":[0,0,40000000,50000000],"float_carries":[],"float_placements":[],"float_queue_after":[],"float_queue_before":[],"frames":[{"after_position":{"flow_id":5,"ordinal":0},"before_position":{"flow_id":5,"ordinal":0},"column_index":null,"frame_flow_id":5,"kind":"header","rect":{"height":3000000,"width":34000000,"x":3000000,"y":2000000},"repetition_index":0,"source_flow_id":5,"terminal":true},{"after_position":{"flow_id":0,"ordinal":6},"before_position":{"flow_id":0,"ordinal":4},"column_index":0,"frame_flow_id":0,"kind":"body","rect":{"height":38000000,"width":34000000,"x":3000000,"y":6000000},"repetition_index":null,"source_flow_id":0,"terminal":false},{"after_position":{"flow_id":6,"ordinal":1},"before_position":{"flow_id":6,"ordinal":0},"column_index":null,"frame_flow_id":6,"kind":"footer","rect":{"height":3000000,"width":34000000,"x":3000000,"y":45000000},"repetition_index":0,"source_flow_id":6,"terminal":true}],"margins":{"bottom":5000000,"left":2000000,"right":2000000,"top":5000000},"master_id":"left","media_box":[0,0,40000000,50000000],"page_index":1,"trim_box":[1000000,1000000,39000000,49000000]},{"balance":null,"crop_box":[0,0,40000000,50000000],"float_carries":[],"float_placements":[],"float_queue_after":[],"float_queue_before":[],"frames":[{"after_position":{"flow_id":7,"ordinal":1},"before_position":{"flow_id":7,"ordinal":0},"column_index":null,"frame_flow_id":7,"kind":"header","rect":{"height":3000000,"width":34000000,"x":3000000,"y":2000000},"repetition_index":0,"source_flow_id":7,"terminal":true},{"after_position":{"flow_id":0,"ordinal":7},"before_position":{"flow_id":0,"ordinal":6},"column_index":0,"frame_flow_id":0,"kind":"body","rect":{"height":38000000,"width":34000000,"x":3000000,"y":6000000},"repetition_index":null,"source_flow_id":0,"terminal":true},{"after_position":{"flow_id":8,"ordinal":1},"before_position":{"flow_id":8,"ordinal":0},"column_index":null,"frame_flow_id":8,"kind":"footer","rect":{"height":3000000,"width":34000000,"x":3000000,"y":45000000},"repetition_index":0,"source_flow_id":8,"terminal":true}],"margins":{"bottom":5000000,"left":2000000,"right":2000000,"top":5000000},"master_id":"right","media_box":[0,0,40000000,50000000],"page_index":2,"trim_box":[1000000,1000000,39000000,49000000]}],"paint_closure_sha256":"a4c29627e81a183f4b1558e19a3e9b448d4a184873c6b3e13db4acfb7e7d21a3","profile":"typaxis.machine-pdf/header-footer-1","profile_receipt_sha256":"9d47cacc1248157e04ff1c487fdc6bb88de2e938d9a2417c777018fcecd43b44","selected_layout_sha256":"5028a9c18f2da332449728c33874963843f8cd99f67f43a62ab7aae14d56c5e9"}
